{
  "id": "redflag-postcoital-bleeding",
  "version": "1.0.0",
  "condition": "postcoital_bleeding",
  "min_age": 18,
  "red_flag": true,
  "priority": 95,
  "inputs": [
    { "name": "postcoital_bleeding_signal", "type": "boolean", "description": "Any reported bleeding after sex in the last 90 days. Collected from users 18+ only." }
  ],
  "logic": {
    "op": "eq",
    "input": "postcoital_bleeding_signal",
    "value": true
  },
  "output_band": "ORANGE",
  "evidence": [
    {
      "title": "Comprehensive Cervical Cancer Control: A Guide to Essential Practice",
      "source_type": "clinical_guideline",
      "organization": "WHO",
      "year": 2014,
      "url": "https://www.who.int/publications/i/item/9789241548953",
      "note": "Post-coital bleeding is a symptom that warrants clinical evaluation. Cervical screening module (spec 5.4.1): minimum band 'see a doctor soon'. DRAFT pending Kenyan clinician sign-off."
    },
    {
      "title": "Suspected cancer: recognition and referral (NG12)",
      "source_type": "clinical_guideline",
      "organization": "NICE",
      "year": 2015,
      "url": "https://www.nice.org.uk/guidance/ng12",
      "note": "Unexplained post-coital bleeding in women warrants referral consideration. Threshold and band are a DRAFT pending Kenyan clinician sign-off."
    }
  ],
  "clinically_validated": false,
  "reviewer_name": null,
  "reviewer_registration_no": null,
  "signed_at": null,
  "changelog": [
    {
      "version": "1.0.0",
      "note": "Initial draft from published guidance. clinically_validated=false pending Kenyan clinician sign-off."
    }
  ]
}
