{
  "id": "fibroid-indicator",
  "version": "1.0.0",
  "condition": "fibroid_indicator",
  "min_age": 13,
  "red_flag": false,
  "priority": 40,
  "inputs": [
    { "name": "avg_bleeding_volume_90d", "type": "numeric", "description": "Average daily bleeding volume score (0-4) over the last 90 days." },
    { "name": "pelvic_pressure", "type": "boolean", "description": "Any reported pelvic pressure or heaviness in the last 90 days." },
    { "name": "urinary_frequency", "type": "boolean", "description": "Any reported increased urinary frequency in the last 90 days." }
  ],
  "logic": {
    "op": "and",
    "operands": [
      { "op": "gte", "input": "avg_bleeding_volume_90d", "value": 3 },
      {
        "op": "or",
        "operands": [
          { "op": "eq", "input": "pelvic_pressure", "value": true },
          { "op": "eq", "input": "urinary_frequency", "value": true }
        ]
      }
    ]
  },
  "output_band": "ORANGE",
  "evidence": [
    {
      "title": "Diagnosis of Abnormal Uterine Bleeding in Reproductive-Aged Women (Practice Bulletin No. 128)",
      "source_type": "clinical_guideline",
      "organization": "ACOG",
      "year": 2012,
      "url": "https://www.acog.org/clinical/clinical-guidance/practice-bulletin/articles/2012/07/diagnosis-of-abnormal-uterine-bleeding-in-reproductive-aged-women",
      "note": "Heavy bleeding with bulk symptoms (pressure, urinary frequency) warrants structural evaluation. Draft thresholds pending Kenyan clinician sign-off."
    }
  ],
  "clinically_validated": false,
  "reviewer_name": null,
  "reviewer_registration_no": null,
  "signed_at": null,
  "changelog": [
    {
      "version": "1.0.0",
      "note": "Initial draft from published guidance. clinically_validated=false pending Kenyan clinician sign-off."
    }
  ]
}
